id,text
AtPEiOJBBa7QlMXKGwhDeg,"Ahi Poke Bowl is the only place I can eat poke at. Every other poke that i have eaten, i always compare it to Ahi!
The portions are reasonable to their..."
AtPEiOJBBa7QlMXKGwhDeg,"Even though there is poke available all over now (Carrolton, Southlake etc) we are still willing to drive 30 mins to go to Ahi Poke Bowl. Here are some of..."
avIegO79W3kTbVKfTaen8g,"A phenomenal lunch special!!! 12 pieces of sushi for $6.50?! Unheard of. I came here on a Saturday afternoon and there were only 3 other people inside, AND..."
avIegO79W3kTbVKfTaen8g,"Had late dinner here last night.

We ordered grilled salmon bento box and shrimp tempura bento.

This place is a Mom and Pop business type of Japanese Sushi..."
avIegO79W3kTbVKfTaen8g,This place is so cute and homey. The couple that owns the place is so attentive and kind. The food was superb and the service was great. I go to a lot of...
tzEC-0cqE0zS1zxijom7CA,I love love LOVE this place! The 3 rolls for $10 deal is something that just can't be beat in that area and the sushi tastes so great for the price!...
tzEC-0cqE0zS1zxijom7CA,"Nothing special, but definitely a good value restaurant! 
I love coming here to help with my sushi cravings when I'm trying to enjoy sushi on a budget. The..."
tzEC-0cqE0zS1zxijom7CA,"Was a regular at this place 8 years ago. Didn't get to come back for couple years. Came back today and there was still same sitting, same rolls and beat of..."
xrcagMriEty7MuYftMrJcg,"Quick and great service!
Loved every bite of poke bowl I had! 

Thank you for great service and food"
xrcagMriEty7MuYftMrJcg,"I come here once a week whenever I want a quick and healthy lunch.  The staff is friendly, fast and the food is great!  The fish are fresh and the bowl is..."
xrcagMriEty7MuYftMrJcg,"Popped in for a quick lunch. Fresh ingredients, fast service. You write your order on a checklist of options and hand it in, and you clear your own table...."
YIgVGcdelXPxRpO68Ba5Ig,I live around the corner from here and I've eaten here at least 50+ times in the past year. I've tried everything from the sushi to fried rice to appetizers...
YIgVGcdelXPxRpO68Ba5Ig,"What a hidden gem! Had I not had a hankering for sushi recently and looked them up on Yelp, I would have kept passing this place by! Moving from CA to TX 2..."
YIgVGcdelXPxRpO68Ba5Ig,"To be fair, this was really very good.. I mean, come on! Surprisingly so, and much better than any grocery store option - and some sushi bars. My hubby and..."
UYijcQJLRiH4fYWTknzQFA,"Do you know how you can tell if a sushi spot (haha) is good or not?

IMO, it's by their California roll (and ofc their fish, but we're gonna talk about this..."
UYijcQJLRiH4fYWTknzQFA,"I went here on a whim to get a somewhat healthy dinner. I love the food court at Legacy, and this was one of the places I needed to check off my list. This..."
UYijcQJLRiH4fYWTknzQFA,Wow! I'm so impressed. I like to try new places I've never tried before and this place set the bar very high. When you first walk in it can be confusing if...
wBctJ8Sy08yOKNBbC5uvmw,"First off, FAVORITE poke spot.  So many varieties to choose from! I'm Vietnamese so I was surprised when I saw they sold shrimp chips here! Love how much..."
wBctJ8Sy08yOKNBbC5uvmw,We just moved down to the Park Cities and this place has become our go to Poke restaurant. I always get it to go and the service is great and you can't beat...
wBctJ8Sy08yOKNBbC5uvmw,"Not bad at all! I liked they don't put too much sauce on the bowls. However, they give a small portion of protein compared to the rice/salad ratio. I had..."
LVmSPlzD6N6L5h9v83wbPg,I just ate at Chasu for the first time and it was delicious!  I had the lo mein base with Chasu as the protein.  The Chasu was so tasty and flavorful!...
LVmSPlzD6N6L5h9v83wbPg,"Everything I ordered was pretty sweet. Not sure if I made poor choices but overall...very sweet, maybe too sweet. 

Quality of food was good, freshness in..."
LVmSPlzD6N6L5h9v83wbPg,"My husband heard about this place from a friend :) 
who said it was ""REALLY"" good, so we decided to check it out. 

First of all, the interior was really..."
vOUOAoPRW27oNJFJLhkNNQ,"So, there are 2 favorite steakhouses i have. No.1 Michael Jordan, No.1.1 Pappas Bros. Again, Awesome steaks! Great vibe and atmosphere. It's a really good..."
vOUOAoPRW27oNJFJLhkNNQ,"I came to Pappa Bros with friends to celebrate a bunch of exciting life events. 

The service, portion sizes, and most importantly quality of food were..."
vOUOAoPRW27oNJFJLhkNNQ,This was the splurge of the Texas vacation.  We were celebrating #1 daughter's birthday.  Spare no expense!  I want the best!...
9e7W6odkoWKpUd6t-6yugA,"My husband and I basically live at this restaurant, because we are unabashedly addicted to the Chirashi bowl; it is so fresh and delicious! If you don't..."
9e7W6odkoWKpUd6t-6yugA,The only reason for me to visit this place is its location. This restaurant is just opposite my office and it is convenient to go grab a quick bite between...
9e7W6odkoWKpUd6t-6yugA,The service was excellent! My favorite dish was the beef bibimbab. The ingredients were super fresh and carefully prepared. I will be coming again for sure.
QbuAgiAMWR7wrLKU7XSi-g,We love the Kenny's variety of restaurants. This was our first visit to Wood Fired Grill and we weren't disappointed. I beleive the servers name was Nicole...
QbuAgiAMWR7wrLKU7XSi-g,"Not really sure how this place is so highly rated. Perhaps the fact that the food is rather exorbitantly priced is making people's brains compensate, trying..."
QbuAgiAMWR7wrLKU7XSi-g,Went with a group for a reunion of sorts...meeting an Army buddy I had not seen we finished our deployment to Desert Storm 28 years ago. The atmosphere was...
PWdsdUAcl5ub8DXUz7AUHQ,"Frank and the team have a great shop here. Gonna be my new go to place. 

We are doing no carbs and Frank did all off the menu items for us that were great...."
PWdsdUAcl5ub8DXUz7AUHQ,"Ummmm.  Came here because of all the great reviews.  I guess if you really like shrimp tempura, sauces, and crab salad, this is your place.

The ""fried""..."
PWdsdUAcl5ub8DXUz7AUHQ,"I hate giving small businesses bad reviews but I have to be honest last night was a terrible experience.

We ordered a special roll and spicy tuna roll...."
K7cmD8XdKgMZO0KDfsw8VA,"Overall: great place, will definitely be back.

Service:
No complaints. Friendly and prompt.

Food:
Great! No complaints. I ordered the edamame and a three..."
K7cmD8XdKgMZO0KDfsw8VA,"New Jewel in Frisco!
Really fresh and creative Sushi
Doesn't look like much on the inside, but it is just what you want from a Sushi spot. 
Did I say..."
K7cmD8XdKgMZO0KDfsw8VA,Our favorite sushi place in Frisco. Great for delivery and dine in. We love the friendly and personal service.
Nw00vHONgJzgvl59NNzceA,"We typically go during happy hour
1-star attentive and quick service
2- their rolls are really good
3- price is very reasonable
4- atmosphere is ideal for a..."
Nw00vHONgJzgvl59NNzceA,"Nice decent cozy little spot in a strip mall. 

Had both a sushi roll combo and a sashimi combo. If I had to choose I would probably opt for their rolls..."
Nw00vHONgJzgvl59NNzceA,"Was working my way thru the top 10 sushi places near me and this was next on the list.  A friend was visiting and wanting sushi so here we went.
WAS NOT..."
YAcRarYclSMDvZFMhpHJ3A,"Happened to be in town needing a quick lunch, and this place popped up on yelp.

WE LOVED IT!

My wife got a variety of sushi rolls, and I had a poke..."
YAcRarYclSMDvZFMhpHJ3A,"Good food.  Had lots of rolls, some sushi & an appetizer.
We will go back. Nice mix of options.
Very casual, no waitstaff, and a decent selection of..."
YAcRarYclSMDvZFMhpHJ3A,"I've been here many times.
Today find hair in my food.
So disgustings.
Service was ok but can't eat.
I won't be back!"
hKA7NVeng9Asa-lDiSXdeQ,I love a good Thai place and Sticky Rice does not disappoint. Their Thai-Laotian cuisine is top notch. The environment is great for a family meal or a large...
hKA7NVeng9Asa-lDiSXdeQ,"Food is great as always. However, I am giving a 3 star because of the customer service this time around. When I walked in, I was not greeted. I stood at the..."
hKA7NVeng9Asa-lDiSXdeQ,Thai restaurant in a strip mall located next to 24 hour fitness. Plenty of parking. The layout of the restaurant is open concept with one big dining room...
ocrgHPhS8SUj2R-agO_SCg,"The sushi tastes extremely fresh and also has a lot of flavor.  Almost forgot, Bao the server is very handsome.  

P.S. looks like yelp won't let me post..."
ocrgHPhS8SUj2R-agO_SCg,I went looking for a new sushi restaurant that was near me and stumbled upon Sushi Go. I really enjoyed their sushi. It's fresh and their are awesome...
ocrgHPhS8SUj2R-agO_SCg,"Since they decided to close my favorite sushi place I had to find another place. FOUND IT!!! This place is awesome.  Great food,  nice service and clean...."
nnPHAES2nTK0SWZUrhuCXg,"This is GOOOOD stuff y'all!! My favorite is the Beef Teriyaki Bowl, have had the Chicken and Salmon.....all were great!! Made with super fresh meats and..."
nnPHAES2nTK0SWZUrhuCXg,Looking for delicious hibachi food without having to go in to a restaurant for the whole experience?? You've found it! The owners are so very kind and...
nnPHAES2nTK0SWZUrhuCXg,This is a great little hibachi food truck between Princeton and McKinney on 380.  We have been here twice and have called ahead both times.  We have ordered...
7PGrGlPmHwfLBRZCQUjIVg,Fast service... Excellent cleanliness... Great food. Cannot say enough good things. Friendly staff. You need to check it out!
7PGrGlPmHwfLBRZCQUjIVg,"I had the In and Out Salmon roll and it was delicious. Perfect amount of flavor and heat, didn't even need soy sauce. I haven't had sushi in so long because..."
7PGrGlPmHwfLBRZCQUjIVg,"Love having these guys so close! Quick, fresh and large portions! The menu is big, with lots of variety. We've tried apps, rolls, nigiri and sashimi. No..."
7Kn8g-hm_V_6TUIDfF5IIA,"Quick tip- come here on a lazy (late Weekend afternoon) and the service and environment is much more relaxed and maybe the food tastes better.

Visited here..."
7Kn8g-hm_V_6TUIDfF5IIA,"Excellent for special occasions, night out with the girls or a cute date night. I brought my friend here to celebrate her birthday and I'm glad I did! I..."
7Kn8g-hm_V_6TUIDfF5IIA,Let me explain and if you want more details I can go into further details  but in short Of everything we ordered our PAELLA had a hair on the clam...after...
Ag59XvlrHHufMkiM0M8vTA,"First time eating this was through Door Dash. I got the Geisha Roll and it was great! It didn't come looking all pretty and neat, but that wasn't the..."
Ag59XvlrHHufMkiM0M8vTA,"This new sushi spot is super fast and convenient living in Wylie. Since Wylie doesn't have a lot of asian spots to offer, I normally eat sushi in the..."
Ag59XvlrHHufMkiM0M8vTA,Another good experience tonight. Got the omakase sushi and sashimi. Shrimp tempura appetizer was good. Tasted tender on inside and crunchy outside without...
rLRKpux39DSmghO6JKk9Uw,"Service was superb!!! Food was fresh and delicious! Came here for the first time, and it won't be our last.  
Update 11/19/19
Best hotpot in Texas, with the..."
rLRKpux39DSmghO6JKk9Uw,"If you don't want to go to the busy k-town for Korean BBQ or shabu shabu, you may want to consider this place, which is located in north Plano (Custer and..."
rLRKpux39DSmghO6JKk9Uw,"This place is a great Korean bbq spot. Been here 2 times now. Can't go wrong with bulgogi, garlic, mushrooms, onions, scallions...

Try it. You'll love it..."
IXk7iJjWX3qFgz0zaQNKcA,"Horrible food they pot little raw food , the costumer service un helpful they not friendly with costomer . The chicken raw and stink, also they pot a little..."
IXk7iJjWX3qFgz0zaQNKcA,Not a fan of mall food but this place was actually good! The manager was working just as hard as the staff. Pleasant attitudes from the staff. Food was hot...
IXk7iJjWX3qFgz0zaQNKcA,"Quick service, polite staff, tasty food. What more can you ask for? Get the chicken and steak with fried rice. It's more than enough for two meals."
Fht-YIJDMaa9SFtP7lf03Q,I am so happy to have a new poke bowl place near my house which is actually great. I typically order my bowl on the app. If you use the app your first time...
Fht-YIJDMaa9SFtP7lf03Q,"Surprised to share this review, but I came here on an off night apparently. Staff was hanging out at the bar with a few patrons. I stood at the front and..."
Fht-YIJDMaa9SFtP7lf03Q,I am still in love with poke bowls and Go Fish Poke should expect to see me at least once a week for the next few months. If you're new to poke this is a...
TVRJjLl42PGKUKfhlBJNmw,This is a little hidden gem. Outside doesn't look that great but when you walk in...omg it's night and day. It's like you have walked into something...
TVRJjLl42PGKUKfhlBJNmw,"My hubby and I were fascinated with this food court. You can find Chinese, Japanese, Korean, Cajun, tea drinks, and more all in one spot. Like any food..."
TVRJjLl42PGKUKfhlBJNmw,"When you eat here, don't get Food Court in your teeth. If you do, use toothpicks or floss or something.

I was surprised to find such a cool facility in the..."
l6PE6zenhz6YcY5WV9s8Og,"This is a really cool Thai spot in an unassuming location in Euless. It's great here! It's pretty little and cozy, but the space doesn't feel too crowded...."
l6PE6zenhz6YcY5WV9s8Og,"This place is so awesome. We stopped by for a late lunch and literally left completely stuffed, Major left overs in hand and a huge smile on our faces. The..."
l6PE6zenhz6YcY5WV9s8Og,"First time going there, service was so so. Had a split bill, they couldn't even swipe debit cards they had us write our card number and info down (what..."
z4IPKxvsfbrDOcdMMgtcRQ,"Daughter ordered the steam led chicken dumplings she says they were excellent. I cannot confirm because I am vegetarian. 

What I can confirm is that this..."
z4IPKxvsfbrDOcdMMgtcRQ,"We have ordered delivery from these guys several times but today I went in there for late lunch. Their miso soup is wonderful, lots of seaweed and mushrooms..."
z4IPKxvsfbrDOcdMMgtcRQ,The food here is really good. Better than I thought it was going to be. My boyfriend is a super picky eater and even he likes it here. I've tried the sushi...
kJeccdUgRVc5yUlmvLyPtw,"BBQ Chicken is my favorite Korean fried chicken place in Carrolton! 

There are many flavors to choose from (Gangnam, Honey Garlic, Soy Garlic, Parmesan,..."
kJeccdUgRVc5yUlmvLyPtw,I was invited back after they saw my review because they wanted to make things right - this review is a big thanks to Luna and Claire for being awesome and...
kJeccdUgRVc5yUlmvLyPtw,"Holy sweet baby jesus.

What is there not to love about BBQ Chicken?

This is not your standard american fried chicken fare. It's KFC (korean - not..."
2-b1aEKbgxLl2Svgp1Ex5w,"Deep underneath MIT in Boston, and full of sewage, is the MIT Sewer. This is not that.

Pretty amazing food court inside Mitsuwa which features all of your..."
2-b1aEKbgxLl2Svgp1Ex5w,I will give it 4 stars. There are definitely a lot of other really good/better Japanese restaurants out there but this food court isn't bad and can...
RLs-aBWQ0uHxP_e5JNw9kg,"Absolutely love this place. Their food is quite authentic and very affordable. 

I must warn you though. They have this fermented bean soup that smells like..."
RLs-aBWQ0uHxP_e5JNw9kg,"Had a difficult time whether I should give 3 or 4 stars because I can't give 3.5; so, 4 it is... but know that it's 3.5.

FOOD//
I've been going to Ajumma..."
RLs-aBWQ0uHxP_e5JNw9kg,"I always end up coming back here. You can't beat the price of their korean fast food. Their mini kimbap (they have two varieties; spam and egg, and spicy..."
CxrKQJ7zP4swSwVcXxZ_fA,Finally able to catch this place open at the same time we were craving something hot and spicy to treat a head cold. We couldn't have picked a better place....
CxrKQJ7zP4swSwVcXxZ_fA,"We love this place! Service was very nice, we got a lot of good recommendations. Kimchi is made in house - it is super delicious! Galbee was my favorite...."
CxrKQJ7zP4swSwVcXxZ_fA,It was a cold day so it seemed like a good day to get soup. We went here for a Saturday lunch right when it opened. Immediately I was liking the decor. It's...
pgitOnp8rmmuc6sJYRLNEA,"I've recently relocated from DC and was pleased to find so many options for Vietnamese just down the street from my new home! 
I ordered the fresh spring..."
pgitOnp8rmmuc6sJYRLNEA,"First time visit today.

Pho with rare beef and tendon was fantastic.

Che ba mau was amazing.

The menu is vast with a lot of classic and unique Viet..."
pgitOnp8rmmuc6sJYRLNEA,"First time here.
Very friendly and attentive 
Not a real big fan of ginger but the pho is tasty and the small can feed two peopl
I will be back"
roAjB6jrTYIa87_bd0b2cg,"Such an amazing turkey burger! 

I was in the mood for something a little different and thought I'd try the turkey burger. It was a risk but I kept..."
roAjB6jrTYIa87_bd0b2cg,"Simple, delicious and not too fussy.
This time around I opted for a Psychedelic burger, done with mushrooms (hence the name), lettuce, tomato, onions, swiss..."
roAjB6jrTYIa87_bd0b2cg,We had planned to go to Munchiez after reading all the reviews and when we got there it was closed on a Friday Night (11/08/2019) at 7pm. No note on the...
NlYquYFSwhqPFdkd84Trzg,"I LOVEEE THIS PLACE! I've only been to about 3 other different poke joints and this one has been the best by far.

I went for the first time with my..."
NlYquYFSwhqPFdkd84Trzg,"Ugh; myself and a few friends have made Go Fish Poke quite a regular Poke place for us. We've been several times in the past few months, and we typically..."
NlYquYFSwhqPFdkd84Trzg,"This place is great for make your own poke, with tons of delicious options to choose from. Everything is very fresh and flavorful, with the purple rice and..."
TPQZM42fnAbSvwtt3GYUWQ,"This place has one word for it - ""awesome""!

Located a few miles out of the city and took us a 30 min drive from north Dallas. It's located in a compound..."
TPQZM42fnAbSvwtt3GYUWQ,I think the packaging for sushi is deceptive. I looked at the farm raised sushi assortment and the wild caught sushi assortment and the salmon was identical...
TPQZM42fnAbSvwtt3GYUWQ,"Overall food court score 4/5

I love the food court...I wish there was more to write. The stalls and vendors are plentiful and have a good variety from..."
R7POrCuNI3UEbFaEnPM1gg,"Fresh food, easily customizable, friendly staff. I love coming here with my UTD friends, especially because we get a 10% discount. There are a bunch of..."
R7POrCuNI3UEbFaEnPM1gg,Paid around $24 for a large bowl meal (with drink) and a burrito! (Feeds two for $24) Was originally $27 but student discount! Prices have raised $1 or so...
R7POrCuNI3UEbFaEnPM1gg,"This is an overdue review. After trying several poke places in the Richardson/Plano area, this is the best bang for your buck + flavor. It's my favorite..."
zDzMENCBnI-J1b0OZeT4Lw,"I'm a student at UTA and it's refreshing to have such a unique place close to campus. I'm tired of eating fast food or heavy meals. Namoo is delicious,..."
zDzMENCBnI-J1b0OZeT4Lw,"This is a really solid lunch spot for my coworkers and I. Close by the Entertainment District, this eatery has a selection of bowls to choose from. They..."
zDzMENCBnI-J1b0OZeT4Lw,Good option for college students. I love that they give you a free water bottle with your meal :)
Yy7isfBJ0aThva1Tj2I6tA,Best ramen in town and great poke too. The owners are so nice and have a creative take on ramen with fresh ingredients.
Yy7isfBJ0aThva1Tj2I6tA,"I hadn't seen this spot before when visiting Bonchon but it's a cute little shop that has a variety of poke options.

I do think the price is a little extra..."
Yy7isfBJ0aThva1Tj2I6tA,"I usually create my own Poké bowl when I go to these places, but today I decided to try the pre-made 365 Trio bowl. The fish and ingredients individually..."
yQsZhB8j2_9KgQrUKDMRFQ,"I loved their take on Poke. I liked the option of making your own poke. They had a plethora of options and for the price, you get a ton of food. I couldn't..."
yQsZhB8j2_9KgQrUKDMRFQ,Went here on a weekday for lunch. Nice and clean.  You can order sushi or poke bowl. You have sheets to fill out your order hanging to the right of the...
yQsZhB8j2_9KgQrUKDMRFQ,I got a BYOB and it wasn't busy at all. I was in and out. The service and food were both great and the restaurant was super clean and a relaxed atmosphere
JvKxiLTX-61xdT8mB5eKlg,"This place was fantastic!

This place may not be super traditional so much in the delivery and presentation but the food was absolutely stellar.  I only say..."
JvKxiLTX-61xdT8mB5eKlg,"Update: This place is now under a new ownership, Paul's Namoo. Honestly, it's the best owners thus far. The seaweed soup I love so dearly was even more..."
JvKxiLTX-61xdT8mB5eKlg,"Service and food is bedazzling!

This tiny spot in a strip mall has huge flavor and great service.  Full disclosure - I have no idea what the name of the..."
xWDFPIGGkd4zxNQkBq0W4Q,"They have a few tables inside if you want to dine in, but it seems mostly a takeout business. I got the spicy noodle bowl and seaweed salad. Both were..."
xWDFPIGGkd4zxNQkBq0W4Q,Always great service! The owners are such wonderful people! The rolls are some of our favorite in Allen!
xWDFPIGGkd4zxNQkBq0W4Q,"The crabby fries had some nasty smell, I couldn't eat them the smell was strong. The volcano roll tasted raw and it's suppose to be baked, the rice was..."
2X8eD8m9fmZW4G1yE8GBpg,"TLDR: K-town Burger add EZ Egg and American Cheese. F'n legit. Do it. Do it now. 

Visit: Weekday (dinner)
Order: K Town Burger with EZ Egg and American..."
2X8eD8m9fmZW4G1yE8GBpg,His: This burger is just so good! I ordered the K-Town burger and could not believe how good Kimchi tastes on a burger. It was cooked well too. One thing...
2X8eD8m9fmZW4G1yE8GBpg,"This place has AMAZING food
Its a korean-fusion restaurant that takes korean flavors and puts it into american cuisine.
10/10 highly recommend"
E0C8S3bYbh_Qb4ZFWM8q-A,A friend and I were recommended by someone to go and I'm so happy that I actually took them up on it. The inside was so comfy and VERY clean. I loved the...
E0C8S3bYbh_Qb4ZFWM8q-A,"So, I had been craving sushi while grocery shopping but didn't want to sit down alone and eat. I saw this place lit up with others on Debbie Lane and..."
E0C8S3bYbh_Qb4ZFWM8q-A,"A new Asian Fusion restaurant in Mansfield, it's hip and trendy, nicely decorated and clean.
It's a place to eat healthy, on your bowl you choose your base,..."
zuqC0_POZRB1whmr2KEFKA,"The bulgogi bento box is amazing! We got two different boxes and a roll and I'm super into it. 
The service is really nice and fast. Plus a cash discount if..."
zuqC0_POZRB1whmr2KEFKA,I am not going to lie I have a thing for my newly discovered Sushi go restaurants! But what I learned today is not all of these places are created equal and...
zuqC0_POZRB1whmr2KEFKA,First time trying sushi that wasn't from my friend from Thailand. He make great sushi. Tried this place and it was good. I will eat from here again
44VUJdlYqXWyjmb1G_fQFA,"Hot stone bowl rice here is so delicious!! I love how bowls here are customizable, and that there's a complimentary buffet line for you to pick up miso soup..."
44VUJdlYqXWyjmb1G_fQFA,"Such a great concept, I love that you can have a delicious bowl of bi bim bop fairly quick. I had the stone pot spicy beef with everything in it. I also..."
44VUJdlYqXWyjmb1G_fQFA,"I agree the quality of food has changed!! This was a go to place for me and my family weekly, but its not the same. 
Not just the quality, but the quantity..."
j4d4p47CbSe8cZRQR-806g,A must go Korean food restaurant for both Korean food beginners and experts. Clean and illuminating atmosphere with play room for kids. The food was...
j4d4p47CbSe8cZRQR-806g,Beautiful set up! Bright and lots of seating. The lady working behind the counter was very friendly and had lots of suggestions and gave us insight into the...
j4d4p47CbSe8cZRQR-806g,This place is great! We got the bimbibop and it was delish. A pleasant surprise was a mashed pumpkin mix that reminded me of mashed potatoes. Great point too.
aXoV3PWOd5Y6uTYksUjHbQ,"World class poke in Frisco, Texas? YES. No joke. 

I've eaten at the top rated poke places in Southern California, New York, Chicago... so when I was..."
aXoV3PWOd5Y6uTYksUjHbQ,"Had my first Poke experience here, and I think I'll just stick with this place! The ingredients and sauces were so fresh and flavorful, and there were..."
aXoV3PWOd5Y6uTYksUjHbQ,"The quality of foods was great. Only thing I have to say is "" do not order for delivery "". I used Uber eats and the deliver told me that they putting off my..."
5q0w97C5h4Y_Jh-wrTL0eg,"Okay umm $17 for a Salad was kinda steep especially since I wanted to make this my ""everyday lunch spot"". But let me tell y'all... one of the best salad..."
5q0w97C5h4Y_Jh-wrTL0eg,"Best salad place I've been to 
The location is good not too big or small, the staff are all nice and make you feel welcome and get to know you by name. The..."
5q0w97C5h4Y_Jh-wrTL0eg,The salads here are very good although they use the Subway philosophy of big helpings of cheap stuff and going chintzy on the better ingredients. I'm...
6P4_UqMUqW67Lfs1LVGrLg,Wonderful Anniversary dinner - the food was all delicious and served at a nice pace (didn't feel rushed at all).  My personal favorites were the parmesan...
6P4_UqMUqW67Lfs1LVGrLg,The food is good - waiters and staff are good - but do NOT trust the prices they give on the website!  They charged us more than the website stated $45 vs...
6P4_UqMUqW67Lfs1LVGrLg,"Not so good slow service and meats were not good. 
We ate on Thanksgiving 2019 

gristle in meats must have gone to cheap grade.
I would not recommend."
