id,text
vy7HBv_IQ0lJNLfnXT80Pw,I was here on a business trip and trickled into the 99 Ranch Market. I was hungry so I tried this place out. This place is soooo good! The customer service...
vy7HBv_IQ0lJNLfnXT80Pw,I eat poke all the time in LA this is by far the BEST poke I've ever had.  The seafood tastes sweet and fresh - especially the scallops.  You can have as...
vy7HBv_IQ0lJNLfnXT80Pw,This is one of the freshest poké/seafood I've ever had! And I am a huge fan of poké/sashimi so I've eaten my fair share of seafood. My favorite is the salad...
tXG82CsL1C9ug4uErGJdXg,"One of the best poke bowls I've ever been to. The lady owner is super sweet and came by to thank us for having lunch there. She's so cute.

This place is..."
tXG82CsL1C9ug4uErGJdXg,"Excellent service!!  Fast, friendly presentation of some delightfully delicious food served with fresh, flavorful ingredients.  I would expect to pay more..."
tXG82CsL1C9ug4uErGJdXg,"Tried this place for the first time and I don't regret it at all. 

Service 10/10- Lady was really nice and made sure everything was precise and perfect. As..."
